{
  "schema_version": "self_review_sidecar.v1",
  "head_commit": "1f984641871ee9994b80f75f608a9f336d0c24d2",
  "created_at": "2026-02-24T23:38:22Z",
  "markdown_sha256": "fb66a8f64a793c47ba01311683e40330ade51a41b005368b257a342f54ed6814",
  "markdown_path": "reviews/reconciliations/S1/SELF_REVIEW_R5b.md",
  "story_id": "S1",
  "skills_run": [
    {
      "name": "pr-review",
      "exit_status": "completed",
      "finding_counts": {
        "P0": 0,
        "P1": 0,
        "P2": 3
      },
      "receipt_path": "reviews/reconciliations/S1/receipts/r5b_pr_review.json"
    },
    {
      "name": "failure-mode-review",
      "exit_status": "completed",
      "finding_counts": {
        "P0": 0,
        "P1": 0,
        "P2": 1
      },
      "receipt_path": "reviews/reconciliations/S1/receipts/r5b_failure_mode_review.json"
    },
    {
      "name": "strategic-failure-review",
      "exit_status": "completed",
      "finding_counts": {
        "P0": 0,
        "P1": 0,
        "P2": 0
      },
      "receipt_path": "reviews/reconciliations/S1/receipts/r5b_strategic_review.json"
    },
    {
      "name": "contract-review",
      "exit_status": "completed",
      "finding_counts": {
        "P0": 0,
        "P1": 0,
        "P2": 0
      },
      "receipt_path": "reviews/reconciliations/S1/receipts/r5b_contract_review.json"
    },
    {
      "name": "validator-audit",
      "exit_status": "completed",
      "finding_counts": {
        "P0": 0,
        "P1": 0,
        "P2": 0
      },
      "receipt_path": "reviews/reconciliations/S1/receipts/r5b_validator_audit.json"
    },
    {
      "name": "devils-advocate",
      "exit_status": "completed",
      "finding_counts": {
        "P0": 0,
        "P1": 0,
        "P2": 0
      },
      "receipt_path": "reviews/reconciliations/S1/receipts/r5b_devils_advocate.json"
    }
  ],
  "total_blockers": 4,
  "premortem_crosscheck": {
    "s2": "CHECKED",
    "s4": "CHECKED",
    "s5": "CHECKED",
    "s6": "CHECKED",
    "s10": "CHECKED"
  },
  "at_proof_gaps": []
}
