{
  "schema_version": "self_review_sidecar.v1",
  "head_commit": "e04a39f9150316caa2a97a5e371cbb5ab7284f5a",
  "created_at": "2026-02-24T20:34:27Z",
  "markdown_sha256": "93f83dad4228ab4daf62d3b35e2117d8a2ae4ffc2c56860ac6ad7bf3c8b4a9ad",
  "markdown_path": "reviews/reconciliations/S0/SELF_REVIEW_R5b.md",
  "story_id": "S0",
  "skills_run": [
    {
      "name": "pr-review",
      "exit_status": "completed",
      "finding_counts": {
        "P0": 0,
        "P1": 1,
        "P2": 3
      },
      "receipt_path": "reviews/reconciliations/S0/receipts/r5b_pr_review.json"
    },
    {
      "name": "failure-mode-review",
      "exit_status": "completed",
      "finding_counts": {
        "P0": 0,
        "P1": 0,
        "P2": 1
      },
      "receipt_path": "reviews/reconciliations/S0/receipts/r5b_failure_mode_review.json"
    },
    {
      "name": "strategic-failure-review",
      "exit_status": "completed",
      "finding_counts": {
        "P0": 0,
        "P1": 1,
        "P2": 4
      },
      "receipt_path": "reviews/reconciliations/S0/receipts/r5b_strategic_review.json"
    },
    {
      "name": "contract-review",
      "exit_status": "completed",
      "finding_counts": {
        "P0": 0,
        "P1": 1,
        "P2": 2
      },
      "receipt_path": "reviews/reconciliations/S0/receipts/r5b_contract_review.json"
    },
    {
      "name": "validator-audit",
      "exit_status": "completed",
      "finding_counts": {
        "P0": 0,
        "P1": 0,
        "P2": 3
      },
      "receipt_path": "reviews/reconciliations/S0/receipts/r5b_validator_audit.json"
    },
    {
      "name": "devils-advocate",
      "exit_status": "completed",
      "finding_counts": {
        "P0": 0,
        "P1": 0,
        "P2": 2
      },
      "receipt_path": "reviews/reconciliations/S0/receipts/r5b_devils_advocate.json"
    }
  ],
  "total_blockers": 18,
  "premortem_crosscheck": {
    "s2": "CHECKED",
    "s4": "CHECKED",
    "s5": "CHECKED",
    "s6": "CHECKED",
    "s10": "CHECKED"
  },
  "at_proof_gaps": [
    {
      "at_id": "AT-023",
      "description": "Probe/keys behavior is implemented for CLI checks; transport-level proof for AT-023 is deferred to S8.9 via DEBT-S0-004-007."
    },
    {
      "at_id": "AT-022",
      "description": "Contract endpoint proof for AT-022 is deferred to S8.9; Slice 0 self-review scope intentionally carries partial coverage."
    }
  ]
}
